category,title,url,timestamp,articles
Singapore,Man who chopped down town council's papaya tree and threatened cat feeder gets jail,https://www.channelnewsasia.com/news/singapore/papaya-tree-chopped-threatened-cat-feeder-jail-14762034,1620365867,"SINGAPORE: A man who chopped down a papaya tree belonging to a town council and waved the weapon at a nearby cat feeder was given three weeks' jail on Friday (May 7). Ang Say Chee, 60, pleaded guilty to one charge of criminal intimidation by raising a chopper at the cat feeder. Another two charges were taken into consideration: Chopping down half a papaya tree belonging to the Bishan-Toa Payoh Town Council and causing wrongful loss to the public in an act of mischief; and burning a red cloth in a rash act endangering personal safety. The court heard that Ang lived in a flat at Toa Payoh Lorong 4. At about 2.30pm on Aug 6, 2019, he placed a chopper in a plastic bag and went to the void deck of Block 56, which was near his home. He hacked down a large papaya tree there as he believed the tree was possessed by evil spirits. A 70-year-old woman who was nearby and about to feed a stray cat heard the tree falling. She saw Ang walking away from the tree and towards the cat she was about to feed. When Ang saw her, he tried to snatch a container of cat biscuits that she was holding, and it fell from her hands. He said ""dirty dirty"" and told her he wanted to call the police, and she replied that she would wait for the officers to arrive. Ang took out the chopper from his plastic bag and raised it above his head. He pointed the weapon at the victim's head and told her he was unhappy that she was feeding the neighbourhood cats. The victim called the police for help and retreated, hiding behind a pillar while Ang sat on a stone bench and later threw the chopper away. The weapon was not recovered. The police arrested Ang when they arrived. The prosecutor asked for at least three weeks' jail, noting that Ang had used a chopper with the intent to cause alarm, but that there was no overt threat. He also did not pursue the victim, but discarded the weapon. However, Ang has a string of past convictions from 1979 for crimes ranging from housebreaking, taking an intoxicant into a public hospital, mischief, affray, rape and rash acts endangering life or safety. For criminal intimidation, he could have been jailed up to two years, fined, or both."
Singapore,Man arrested for snatching gold necklace from 81-year-old victim,https://www.channelnewsasia.com/news/singapore/robbery-gold-necklace-81-year-old-victim-singapore-police-14761548,1620359169,"SINGAPORE: A 64-year-old man has been arrested for allegedly snatching a gold necklace from an 81-year-old victim, the police said on Friday (May 7). The police said they were alerted to the incident along French Road in Jalan Besar at 4.35am on Thursday. The suspect got into a confrontation with the 81-year-old man and pulled a gold necklace from the victim’s neck before fleeing the scene, the police said. The victim fell, suffered lacerations on his head and was taken to the hospital. After investigating and using footage from police cameras, officers established the suspect’s identity and arrested him on Thursday. The stolen gold necklace and S$1,718 in cash were recovered, the police said. The suspect will be charged in court on Saturday with robbery with hurt. The offence carries a jail sentence of between five and 20 years and at least 12 strokes of the cane."
Singapore,Malaysian woman admits performing invasive nose treatment illegally in Singapore hotel,https://www.channelnewsasia.com/news/singapore/malaysian-woman-admits-invasive-nose-treatment-thread-lift-hotel-14755868,1620297030,"SINGAPORE: A Malaysian beauty consultant came to Singapore to perform illegal invasive beauty procedures on customers, administering a local anaesthetic and prescribing medication out of a hotel room on one occasion. One of her customers, who hired the beauty consultant for a nose thread lift procedure, reported the woman to the Ministry of Health (MOH) after the treatment. The nose augmentation procedure involves inserting threads into the nose to enhance the shape of it. Tan Shu Min, 26, pleaded guilty on Thursday (May 6) to three charges under the Health Products Act of importing health products without a valid licence, one charge under the Medical Registration Act of performing a nose thread lift procedure when she was not a registered medical practitioner and another under the Poisons Act of importing syringes containing lignocaine, a local anaesthetic. Another 10 charges will be considered in sentencing. The court heard that Tan was working in Malaysia when she decided that she could make better earnings in Singapore after converting the currency into ringgit. She thought that Singapore has a better market for beauty procedures for botox and filler, the court heard. In early 2019, she began advertising her services for botox, filler injections and other beauty treatments on Instagram, by posting before and other photos she found on the Internet. In January 2019, a victim chanced upon the Instagram account sg_aesthetics26 and sent a WhatsApp message to Tan asking about her beauty treatments. They agreed to meet at Genting Jurong Hotel at 11am on Jan 27, 2019. A few days before that, Tan entered Singapore from Malaysia via Tuas Checkpoint and checked in to the hotel. She met the victim on the planned date, and the victim noticed that Tan was in the middle of attending to an unidentified customer when she arrived. She asked the victim to lie down, and put on surgical gloves, cleaned the victim's nose bridge with alcohol and injected lidocaine into her nose before inserting more than five threads inside. As there was mild swelling around the victim's nose, Tan gave her two types of oral medication that she claimed were antibiotics. The victim paid her S$400 to S$600 for the procedure, the court heard. After this, Tan suggested via WhatsApp that the victim consider adding more threads for a more defined look. Subsequently, the victim sent MOH an email to say that a Malaysian woman was offering illegal aesthetic treatments such as fillers and augmentation for double eyelids and breasts and advertising the services on an Instagram account. After receiving feedback, the authorities conducted a joint inspection and nabbed Tan, seizing syringes containing lidocaine. Tan was not registered with the Singapore Medical Council and did not have any certificate authorising her to carry out those procedures. PROSECUTION SEEKING SIX MONTHS' JAIL AND FINE The case was handled jointly by prosecutors from MOH and the Health Sciences Authority. The MOH prosecutor called for at least six months' jail for charges under the ministry's purview, and the HSA prosecutor asked for fines for the charges of importing health products without a licence. MOH prosecutor Andre Moses Tan highlighted Tan's motive for profit and the fact that she entered Singapore to commit the offence. ""She targeted Singaporean residents on the basis that with the exchange rate she would earn higher profits than in Malaysia,"" he said. The defence asked for four weeks' jail and a lower fine, saying his client was extremely remorseful and that her period of offending was not more than five months. She has been ""bouncing between Singapore and Johor where her family is based"" and has spent a lot of time in her life in Singapore, he said. The judge adjourned sentencing to May 28."
Singapore,Woman arrested for allegedly using credit card that she stole while at workplace for job interview,https://www.channelnewsasia.com/news/singapore/woman-arrested-stole-credit-card-job-interview-14755916,1620296530,"SINGAPORE: Police on Thursday (May 6) arrested a 30-year-old woman who allegedly used a credit card that she stole while she was at a workplace for a job interview. The police received a report on Tuesday from a victim who discovered several unauthorised transactions had been made with her missing credit card. Officers from Commercial Affairs Department established the identity of the 30-year-old woman and arrested her on Thursday. Preliminary investigations revealed that the woman had attended a job interview at the victim's workplace and had allegedly ""misappropriated the victim's credit card"", the police said. She allegedly used the card to make more than 20 unauthorised transactions amounting to more than S$5,000. ""Some of the items that were purchased using the victim’s credit card included two necklaces and two wallets. The necklaces and wallets were recovered and seized as case exhibits,"" said the police. The woman will be charged in court on Friday with cheating. If convicted, she could be jailed for up to 10 years and fined. The police reminded members of the public to take steps to prevent the unauthorised use of their credit or debit cards. This includes opting for an SMS notification to be sent to their mobile phones for any charges incurred on their cards, checking their bank statements regularly and alerting the bank if they spot discrepancies or unauthorised charges."
Singapore,Workshop owner charged with performing illegal vehicle modifications,https://www.channelnewsasia.com/news/singapore/workshop-owner-charged-illegal-vehicle-modifications-14755628,1620291649,"SINGAPORE: The 39-year-old owner of a motor workshop in Ubi was charged in court on Thursday (May 6) with three counts of performing illegal vehicle modifications. Raymond Tan Chia Long, the owner of Fong Kim Exhaust Racing Development, was charged under the Road Traffic Act with replacing the exhaust systems of two cars with unapproved systems on three separate occasions. Court documents show the alleged offences occurred in June 2019, September last year and March this year, with one car getting its exhaust system replaced twice. For performing illegal vehicle modifications, first-time offenders face a fine of up to S$5,000, up to three months in jail, or both. The penalties are doubled for repeat offenders. Modifying a vehicle illegally is a serious offence, said the Land Transport Authority (LTA) in a media release on Thursday. “Such illegal exhaust modification affects the durability and reliability of the vehicle, and increases the safety risks to both the driver and other road users,” said the LTA. Such modifications can also result in excessive noise, causing public nuisance, it added. The agency noted that motorists must seek its approval before modifying exhaust systems. “Only certified exhaust systems, which have undergone stringent testing in compliance with international standards, and are compatible with that particular make and model of the vehicle will be allowed,” it said. “These exhaust systems are also required to meet the prevailing noise and exhaust emission requirements set by the National Environment Agency.” It added that vehicle owners should check if their planned modifications comply with LTA’s guidelines before proceeding. Information on vehicle modifications are available on the agency’s One Motoring website. “LTA takes a serious view of illegal modifications as they may pose serious safety and environmental hazards,” it said. Senior Minister of State for Transport Amy Khor said in Parliament in March that stricter penalties and regular enforcement have reduced the number of illegal vehicle modifications in Singapore, from about 1,800 per month in 2015 to around 550 per month last year. In the past two years, LTA has issued an average of 610 notices of offences per month to owners of illegally modified vehicles, said Dr Khor then. Separately, a five-day operation by the authorities in March - which came after a car crash in Tanjong Pagar which killed five people - found 54 offences related to illegal vehicle modifications."
Singapore,"Woman fined for selling Malaysia-imported weight loss pills that contained 'poison' on Qoo10, Shopee, Instagram",https://www.channelnewsasia.com/news/singapore/woman-fined-selling-weight-loss-pills-online-sibutramine-poison-14755474,1620287814,"SINGAPORE: After trying out a weight loss product and finding it effective, a woman began importing bottles of the pills from Malaysia and selling them online to customers in Singapore via Qoo10, Shopee and Instagram. However, the Clinic K pills contained sibutramine, a substance banned in Singapore since 2010 because of an increased risk of heart attacks and strokes. After a customer reported to the Health Sciences Authority (HSA) about developing a rapid heartbeat, breathlessness and dizziness after taking the pills for two days, the seller was nabbed. Maithili Vijayakumar, 37, was fined S$6,000 by a court on Thursday (May 6) for one charge of possessing for sale 13 bottles of capsules that contained sibutramine, a poison listed under the Poisons Act. If she does not pay the fine, she will have to serve three weeks' jail in default. The court heard that Maithili ordered the pills in January 2020 for her own consumption. They were marketed to be of ""safe medical grade"" and as the ""No. 1 clinical weight-loss formula in Korea"", containing natural ingredients like amino acids and green tea extract. As Maithili found the pills effective, she began ordering more from her Malaysian supplier in Ipoh for her online account, Misty Beauty Bar, which operated on Qoo10, Shopee and Instagram. She bought more than 200 bottles for S$55 per bottle and marked up the prices to either S$99 or S$110 for each and sold most of them over two-and-a-half months. Maithili earned between S$8,000 and S$10,000 in profits. One of her customers bought a bottle for S$110 from Qoo10 in May 2020 and developed a rapid heartbeat, dizziness and other symptoms. Even after halving the dose and later discontinuing the consumption of the pills, the symptoms persisted and the woman made a report to the HSA. The authority analysed the pills and found high levels of sibutramine in them. The substance was previously a prescription-only medicine for weight loss, and was banned in Singapore since 2010 because of the increased risk of heart attacks and strokes. The level of sibutramine found in the product was double the maximum daily dose previously allowed. The marketing materials included a ""warning"" of potential effects such as nausea, dizziness, restlessness and rapid heartbeat due to the product's ""caffeine content"", but the effects are in fact associated with sibutramine. When the HSA inspected Maithili's home in June 2020, they found 13 bottles of Clinic K with 780 capsules in total and seized them. The prosecutor called for a fine of S$7,000, saying that Maithili had leveraged three online platforms with a wide pool of customers, and that adverse effects were reported in one customer. Maithili's defence lawyer urged for a fine less than S$7,000, saying his client is remorseful and had stopped selling the pills when notified by the HSA. She could have been jailed up to two years and fined up to S$10,000 for contravening the Poisons Act."
Singapore,"Repeat offender gets jail for taking upskirt videos of girls, women near SUSS, SIM and train stations",https://www.channelnewsasia.com/news/singapore/repeat-offender-gets-jail-for-taking-upskirt-videos-of-girls-14754736,1620277909,"SINGAPORE: Eight months after being released from probation for taking upskirt clips, a man resumed his voyeuristic ways, heading to train stations and going to schools to record videos of women and girls. Marcus Phua Xie Yi, 24, was given 15 weeks' jail on Thursday (May 6) after pleading guilty to 15 charges of insulting a woman's modesty, with another 28 charges taken into consideration. The court heard that Phua had been sentenced to 18 months' probation in 2016 for insulting a woman's modesty. However, he started taking upskirt videos again during his National Service, between May 2018 and October 2018. He went to places like the Singapore University of Social Sciences (SUSS) and the Singapore Institute of Management, as well as Clementi, Raffles Place and Dover train stations to target female victims. He would not only film under their skirts, but attempt to capture their faces as well, with the judge calling his actions ""brazen"". On Oct 12, 2018, a male student was walking up the stairs at an overhead bridge near SUSS when he noticed Phua in front of him behaving suspiciously and walking closely behind a woman. The male student saw Phua placing his phone near the woman's skirt, before walking past her and shifting his camera to angle it towards her face. After noting that Phua did not walk down the stairs at the other end of the overhead bridge, he spoke to some of his classmates and told them what happened. One of them confronted Phua before calling the police. Phua was arrested and his laptop revealed multiple upskirt videos he had taken of other victims. He would typically trail a victim from behind and take an upskirt video while she was on an escalator or staircase, before filming her face where possible. Defence lawyer Cory Wong of Invictus Law tried to ask for a report assessing if Phua would be suitable for a mandatory treatment order, but the prosecution objected to this. District Judge Marvin Bay said he agreed there was no basis for this, adding that ""at some point one has to draw the line"", referring to how Phua had reoffended and that it is important to ""preserve the privacy of women and girls"". Mr Wong highlighted that his client suffered from major depressive disorder. While this did not contribute to the offences, and he retained a high degree of control over his actions, Mr Wong said Phua was a ""vulnerable person"". His brother died at the age of 10, when Phua was 12, and Phua's father also died of cancer when Phua was 18 or 19, the lawyer explained. Mr Wong highlighted how Phua was under ""a shadow of early deaths"". Judge Bay said he accepted Phua's condition, but said there is a need to ensure that girls and women ""feel free to use public transport and public thoroughfares without any fear that their privacy is not surreptitiously being intruded upon"". ""I also accept that he had a maladaptive coping mechanism using voyeurism to handle personal tragedies,"" added Judge Bay, but said Phua had failed to take the opportunity to reform when he was on probation. For each charge of insulting a woman's modesty, he could have been jailed up to a year and fined."
Singapore,Clementi West death: Man charged with causing grievous hurt to teenage sister with wooden pole,https://www.channelnewsasia.com/news/singapore/clementi-west-death-teenage-sister-brother-wooden-pole-14753910,1620270014,"SINGAPORE: A 29-year-old man was charged on Thursday (May 6) with voluntarily causing grievous hurt to his sister, 10 years his junior, who later died. Huang Bocan is accused of hitting Ms Huang Baoying with a wooden pole on Tuesday at about 11pm at Block 602 Clementi West Street 1. The police said they arrived to find the woman dead. Huang, who is currently remanded, has been issued with a five-day medical certificate. The prosecution said it will apply for him to be remanded at a different division once the medical certificate expires. The judge ordered that Huang be remanded for a week, with permission to take him out for investigations. In a statement issued on Wednesday night, the police said they were alerted to an unnatural death at a residential unit along Clementi West Street 1 at about 6.30am. They found a woman lying motionless in the flat and she was pronounced dead at the scene, while her brother was arrested for voluntarily causing grievous hurt. If convicted of the charge, he could be jailed for up to 10 years and fined or caned. He will return to court next week."
