category,title,url,timestamp,articles
CNA Insider,"Every 7.4 seconds, a woman in China faces domestic violence. Can the tide be turned?",https://www.channelnewsasia.com/news/cnainsider/every-7-4-seconds-women-china-face-domestic-violence-patriarchy-14744216,1620252900,"BEIJING: After enduring six years of attacks, Shaanxi native Yang Xi killed her husband. Life with him had been “worse than hell”, but the last straw was when he came up to her with a rope and axe. He threatened to slaughter her family, including her child, if she did not kill herself. “All those years, he’d often threaten (me) and then make good on those threats,” the 41-year-old recounted. “In that instance, all the grievances accumulated over six years — including him beating my mother and child — finally erupted.” That night, she picked up the axe and killed him. “I didn’t expect myself to have the guts to do such a thing,” she said. “Afterwards I was frightened, yet relieved to know that no one would beat me, my mother, my father and my child any more.”  It was not her first abusive relationship. When she was 17, her fiancé became violent after she asked to delay their wedding. According to her mother, he was of “inferior” character and afraid Yang would change her mind. Over two years, their relationship soured. One day, he pushed her down when they were arguing and gouged her eyes out with his hands. He was sentenced to death, according to her. Feeling like she could not survive as a blind, unmarried woman in a poor rural area, she got married twice — the second time to the man who beat and threatened her. She was sentenced to 12 years in jail for killing him and released after eight years. In jail, where she learnt how to be a masseuse, Yang said she met female inmates who had been similarly abused.  About one in four women in China are said to have experienced domestic violence. Every 7.4 seconds, another woman falls victim to this deeply entrenched problem, according to the All-China Women's Federation, the country’s largest women’s organisation. Can the world’s most populous nation stem the scourge, asks the programme Undercover Asia. ‘PATRIARCHAL POWER’ China remains a traditional society that prizes harmony in the household, arising from Confucian patriarchy. It looks like the email address you entered is not valid. And in some regions, wife-beating is a symbol of “patriarchal power”, said Ma Sainan, the chief lawyer handling marriage and family cases at Jiali Law Firm. “(Some men) don’t think of it as something immoral and may even take pride in it.”  Many women endure more than 30 episodes of violence before they seek help or go to the police, noted Lin Shuang, an anti-domestic violence volunteer in Shanghai for eight years. Even after divorcing or leaving their abuser, some victims are unable to break free. In September, a 30-year-old vlogger from Sichuan province was doused with petrol and set alight by her ex-husband while she was live-streaming at home. Lamu’s death, after she suffered 90 per cent burns, stoked a public outcry. Although a higher proportion of victims are in rural areas, domestic violence is very much present in cities. Abusers may, however, be more “secretive” in order to keep up a “glamorous” front to neighbours and colleagues, said Ma.  Shanghai resident Wei La (not her real name), a successful entrepreneur, told Undercover Asia how a “sensitive soul” she met in 2019 quickly became a manipulative man. One night when she was a few minutes late arriving at his place, his suspicions about her whereabouts turned violent. He rained punches on her head, kicked her stomach and sat on her. “I felt like I was going to die,” she said. When she seized a window of opportunity to run out of the house, he chased her and yanked her out of a taxi. She managed to get to a friend’s place only after a couple passing by stopped to help. He harassed her and threatened to harm her family and make a scene at her company. “My friend asked me why I didn’t leave him, and I had nothing to say,” she said. “It’s not that I didn’t want to leave him, but he’s like a piece of chewing gum. Even after you tear it off, there are remnants.”  GAPS IN THE LAW The authorities have taken steps in recent years to address domestic violence, but activists say gaps persist. They also highlight the role men play in ensuring that harmful norms and notions do not get passed to future generations. About 157,000 Chinese women commit suicide per year, and in a 2016 study by the All-China Women’s Federation, 60 per cent of the cases were related family violence. That year, the government introduced a domestic violence law that allows victims to obtain protection orders against their abusers. State media reported that complaints about domestic violence made to the women’s federation decreased by 8.4 per cent in 2019 compared to 2018. But observers say this is not the full picture.  “When grievous harm is inflicted, the judge still takes into account family conflict as a mitigating factor for a lighter sentence,” cited Ma, who feels that the law does not go far enough. “It’s hard to understand. If you hit someone in the street, you may face jail time of three to seven years. However, for violence in a family setting, one might get only three years, with it hardly ever going to seven years.” Some police officers are insufficiently trained to deal with domestic violence; for instance, they may tell victims their injuries are “too minor”, said Lin. According to her, victims must do “a lot of work” after going to the police, such as collecting evidence and documenting their injuries. WATCH: China's struggle with domestic violence — A potent patriarchy (46:12)  More victims are now willing to dial the police hotline, and the law requires that all calls be accepted, noted Feng Yuan, co-founder of Equality, a women’s rights and gender equality non-governmental organisation in Beijing. “But what’s the problem now? (It’s that) calls aren’t taken properly. When the police hear that it’s a family matter, they’d just give you some casual advice,” she said. “Or even when they hear that it’s domestic violence, they just dismiss it as a family matter and don’t deal with it properly.” AN EX-ABUSER’S STORY As part of efforts to reduce domestic violence against women, the China White Ribbon Volunteers Network — launched in 2013 by sexologist Fang Gang — counsels abusers.  One of its volunteers, Gu Wei, used to beat his wife so badly — with fist clenched “like an iron hammer” — over four years that she filed for divorce. While searching online for information on claiming child custody, he chanced upon a television documentary about domestic violence that, incidentally, featured Yang. He felt “miserable” after watching the women recount their experiences. He called a hotline number provided and spoke to a psychologist trained to work with abusers. He realised he had learnt violence from his father and other male relatives. His parents also saw him mistreating his wife but sided with him. Today, he is “worried” his son will pick up violent behaviour from him.  Now divorced, he has explained to his son that he had hurt the boy’s mother, so she had to leave “to protect herself”. He tells the nine-year-old that they should respect her, and lets him visit her. In 2018, the ex-abuser performed in a play called The Penis Monologues, inspired by American playwright Eve Ensler’s The Vagina Monologues. Written by Fang, it explores masculinity issues including domestic violence. In it, Gu shared that he had asked his ex-wife for five years to prove that he has given up his abusive ways. “I want these violent practices to stop in my generation,” he said. Watch this episode of Undercover Asia here. The programme airs on Saturdays at 9pm. "
Singapore,Teenager to be charged for throwing punching ball down from Bukit Batok flat,https://www.channelnewsasia.com/news/singapore/teenager-to-be-charged-throw-punching-ball-down-bukit-batok-flat-14748558,1620208048,"SINGAPORE: An 18-year-old teenager who allegedly threw a punching ball down from his flat in Bukit Batok earlier this year will be charged in court on Thursday (May 6). The punching ball had a base attached to it, a photo provided by the police showed. The teenager will be charged with a rash act, which carries a jail term of up to six months, or a fine of up to S$2,500 or both. “The police have zero tolerance against acts that endanger the lives or safety of others and will not hesitate to take action against those who blatantly disregard the law,” they said in a news release on Wednesday. The police said that they received a call for assistance at about 11.10pm on Jan 17 along Bukit Batok Street 52. Officers later established that the teenager allegedly threw the punching ball down from his residence, said the release."
Singapore,"Hotel concierge on medical leave for symptoms related to COVID-19 left home to see friend, gets jail",https://www.channelnewsasia.com/news/singapore/hotel-concierge-mc-covid-19-symptoms-stay-home-jail-14748414,1620205688,"SINGAPORE: A hotel concierge at Fullerton Hotel was given medical leave for five days after reporting a cough and runny nose, but failed to stay at home as instructed. Instead of staying at home, Prabu Rajendran went to stay over with a friend and later took a cab home without a mask, falling asleep in the vehicle and getting arrested after tussling with police officers. He was later found to have flouted conditions of his five-day medical certificate while filling up a health declaration at the police station. The 28-year-old man was given two weeks' jail on Wednesday (May 5) for one charge of failing to stay home for five days while on medical leave for acute respiratory symptoms. The court heard that Prabu reported to work at Fullerton Hotel at about 1pm on Apr 2, 2020. As he felt feverish, he told his supervisor of his condition and was told to see a doctor. He left the hotel and went to Raffles Medical Clinic in Raffles Place, where he told a doctor that he had a cough with phlegm and that his nose was runny. He was diagnosed with acute respiratory infection and given sick leave for five days from Apr 2 to Apr 6 last year. The doctor told him to stay at home for the entire duration of his MC, and the hard copy of the certificate stated he needed to do so by law. The doctor advised Prabu that he was allowed to leave home only if he needed medical assistance and asked him to get his family to help if he needed food or to call for food delivery. Prabu went home and took a nap but woke up before 9pm that day. When his friend invited him over for dinner, he agreed and took a cab to her home. He did not wear a face mask despite his symptoms. At her home, he drank alcohol and became intoxicated, and spent the night with her. The next day, when leaving his friend's home, Prabu boarded a cab to return to his home. He did not wear a mask on this trip and fell asleep along the way. When the cab arrived at his home, the taxi driver was unable to get Prabu to alight or pay the fare, so he called the police for help. Police officers who arrived at the scene tried to wake Prabu up and subsequently managed to get him to alight. When they asked him whether or not he intended to pay the cab fare, Prabu became uncooperative and started raising his voice. He was arrested after he failed to calm down and was escorted to Bedok Police Division headquarters. While filling up a health declaration there, he disclosed that he was on five days' MC. He did not have COVID-19. The prosecutor sought at least four weeks' jail, saying that Prabu had symptoms associated with COVID-19 but failed to take reasonable precautions. He left his home for about 13 hours for a frivolous reason, said Deputy Public Prosecutor Sanjiv Vaswani. He also ""displayed a wanton disregard for the safety and well-being of the general public"" and did not tell his friend he was on medical leave, he said. The defence tried to ask for the maximum fine of S$10,000. For failing to comply with the conditions to stay at home as stated in his medical certificate, Prabu could have been jailed up to six months, fined up to S$10,000, or both. Download our app or subscribe to our Telegram channel for the latest updates on the coronavirus outbreak: https://cna.asia/telegram"
Singapore,COVID-19: Banana Leaf Apolo restaurant fined for hosting 40-person birthday party,https://www.channelnewsasia.com/news/singapore/banana-leaf-apolo-restaurant-fined-hosting-party-for-40-covid-19-14748284,1620201973,"SINGAPORE: The Banana Leaf Apolo restaurant was fined S$10,000 by a court on Wednesday (May 5) for hosting a birthday party at its Little India outlet for 40 guests, with a self-service buffet. The general manager of the restaurant chain, which has been operating in Singapore since 1974, pleaded guilty to two charges of breaching COVID-19 regulations. These are for allowing 40 people to gather at the 48 Serangoon Road restaurant between 6pm and 10pm on Sep 12 last year, and for allowing some of them to make speeches. Another three charges were considered in sentencing. The court heard that the restaurant accepted an advance booking for the group for a birthday celebration on the second floor. Employees set up a sound system, microphones and a projector for customers to make speeches and to show a video montage. Food was also laid out for consumption. Safe distancing ambassadors reported that there was a large group of people celebrating on the second floor. According to the ambassadors, as well as what was captured on closed-circuit television, the customers talked and mingled across tables without a 1m safe distance, and the tables and chairs were placed close together. Customers helped themselves to food at the buffet and served it to others, and none of the employees told them not to do this. The restaurant manager was not there when safe distancing ambassadors went down, as he was on the ground floor. The prosecution sought a fine of S$10,000, or S$5,000 per proceeded charge. Deputy Public Prosecutor Stephanie Koh categorised this as ""a serious breach"", as the event lasted four hours and involved a large group of people who intermingled in close proximity. ""This was an event that did pose a high risk of transmission of virus and could have been a cluster if anyone was infected,"" said Ms Koh, adding that it did not happen in this case. She said there was ""no reason"" for the restaurant to accept such a large booking given the COVID-19 restrictions. They did not have measures to manage the movement of customers, and instead, facilitated some breaches by providing equipment, she added. The restaurant manager said in court: ""We would like to apologise for what happened and we have taken a lot of measures to ensure that this doesn't happen ever again, sir."" The company could have been fined up to S$10,000 per charge of breaching a COVID-19 regulation."
Singapore,Lawyer suspended in 2018 for focusing on victim's breast size fined by court for obstructing police,https://www.channelnewsasia.com/news/singapore/lawyer-suspended-2018-focus-victim-breast-size-obstruct-police-14748050,1620196696,"SINGAPORE: A lawyer who was suspended in 2018 for ""disgraceful"" conduct over a ""demeaning"" line of questioning towards a molestation victim was fined S$2,000 by a court on Wednesday (May 5) for obstructing the police. Wong Sin Yee, otherwise known as Edmund Wong, pleaded guilty to one count of obstructing a public servant in the discharge of his functions. He was given a discharge amounting to an acquittal for a second charge of perverting the course of justice in filing a defence case and had been administered a stern warning for this. Wong, 62, was a practising advocate and solicitor and the director of law firm S Y Wong Law Chambers at the time of the offence in 2017. The court heard that a deputy superintendent of the Singapore Police Force led a group of police officers in an operation at the back lane between Lorong 14 and Lorong 16 Geylang on the night of Jan 13, 2017. Police detained about 10 people suspected of being secret society members and were conducting checks on them when Wong arrived at the location and loitered nearby. The deputy superintendent approached Wong and asked if he was a police officer at about 10.10pm. Wong shouted at him in an angry tone, saying he was ""bigger"" than a police officer. When the officer asked him what he meant, Wong shouted that he ""is an officer from the Supreme Court"" and therefore the police officer had to call him ""sir"". His shouting drew the attention of some suspects as well as the public. When the police verified Wong's identity and asked him to leave as his behaviour was hindering their operation, Wong refused to and was arrested. The court heard that Wong has previous convictions, including disobeying an order from a public servant in 1994 and using threatening, abusive or insulting words of behaviour in 2001. The prosecutor said Wong's referring to his status as a lawyer ""sullies the good name of the legal profession"" and the fine must be sufficiently high to reflect this. Wong's lawyer said his client apologises for the wrong he has done but said the police officer was shouting at him, prompting an ""impulsive reaction"" to shout back. In 2018, Wong made headlines after the highest disciplinary body for lawyers suspended him for the maximum five years for professional misconduct. He had stared at the breasts of a victim of molestation during cross-examination and repeatedly asked if she thought she was attractive. After that, he commanded her to stand up and scrutinised her chest. His client was then accused of brushing his forearm against her breast on the train. Wong later said he was trying to mount a case claiming that the victim was unattractive and his client would not have been motivated to outrage her modesty. Any contact that took place was accidental. His client was found guilty and jailed for five months."
