category,title,url,timestamp,articles
Asia,2 face trial as China enforces online control amid pandemic,https://www.channelnewsasia.com/news/asia/china-internet-censorship-cai-wei-chen-mei-terminus2049-14784990,1620698262,"TAIPEI: More than a year after two amateur computer coders were taken by police from their Beijing homes, they are set to be tried on Tuesday (May 11) in a case that illustrates the Chinese government's growing online censorship and heightened sensitivity to any deviation from the official narrative on its COVID-19 response. Authorities have not said specifically why Chen Mei, 28, and Cai Wei, 27, were arrested in April last year, so friends and relatives can only guess. They believe it was because the two men had set up an online archive to store articles deleted by censors and a related forum where users could skirt real-name registration requirements to chat anonymously. Started in 2018, the archive kept hundreds of censored articles and the forum saw discussions on sensitive issues including the anti-government protests in Hong Kong and complaints about the ruling Communist Party. But what got them in trouble with authorities appears to be archiving articles showing an alternative to China's official narrative about its pandemic response just as the country started facing questions over its handling of the initial outbreak. In keeping the censored articles and providing a place for them to be discussed, the two run afoul of increasingly strict regulations in an already stifling online environment under President Xi Jinping. Just last year hundreds were prosecuted for online speech. Chen and Cai are being prosecuted under a catch-all charge of ""stirring up trouble and picking quarrels"". Chen's older brother, Chen Kun, said the court appointed lawyer notified family last week that their case would be heard on Tuesday. In January last year, the two began archiving articles about a mysterious new illness circulating in Wuhan. For Cai, who is from the area and could not go home to see his family for the Chinese New Year holiday, the news was particularly upsetting. ""A lot of things happened in China then that made us very upset, and he may have been affected by that,"" said his girlfriend, Tang Hongbo. She was also detained but released after 23 days when it became clear she did not know much about the project. ""Every day we were looking at the Internet, and we were all in this tragic mindset."" Xi has made cyberspace governance a priority, and under his direction, the government created its own model to manage the challenges and opportunities of the Internet. China eliminated online anonymity by requiring people to register under what is known as the real name system starting in 2016. Social media accounts are linked to a mobile phone number, which is tied to an individual’s national ID number. A Chinese activist, using court and government records and media reports, tallied more than 750 prosecutions for web speech in 2020 in an online database and posted on a Twitter account named SpeechFreedomCN. He said he runs the database anonymously out of fear of retribution. A friend of Cai, who declined to be named out of fear of retribution, said Cai had grown frustrated with the censorship regime. In response, he and Chen launched the Terminus2049 archive and 2049bbs forum in 2018 as a ""public platform of free exchange"", Cai wrote in a welcome post. ""It's not just the 'real name' system – the deletions of posts, the bans, have reached a point that’s really shocking domestically,"" Cai wrote in another 2018 post. ""When you have to worry about whether you have touched a sensitive keyword in any post you write, how can you really have the brave desire to express yourself?"" On the forum, Cai wrote about movies, music and books he liked. Others discussed more sensitive topics. It was a place to speak without worrying about having posts deleted or getting one's account banned. It did not require a phone number to register, or even an email address. Chen was more low-key but similarly chafed against the censorship system. ""He wants information to flow. He wants quality information to flow freely,"" said Chen Kun, his older brother. ""We have this type of value deep in our bones, the independence of discourse on the Internet and the free transmission of information.""  Cai and Chen met in 2011 at a summer camp hosted by Liren College, a socially conscious educational program. Both self-taught coders, they first started cooperating on a project to archive all the lectures and information from the summer camps, said a friend of both, who spoke on condition of anonymity out of fear of retribution. Authorities shut down Liren in 2014. Terminus2049 primarily housed articles that had been deleted from Wechat and Weibo, popular social media platforms that are subject to regular algorithmic and human censorship. While similar databases existed, most were blocked in China. Terminus2049 was available on Github, a code sharing platform that is not blocked. The topics the archived articles touched on were broad, but they shared a focus on social issues. One was concerned about the expulsion of migrant workers from Beijing after a fire, while another shared questions about a company that falsified data on rabies vaccines. It was only after Cai and Chen got arrested that their families found out from friends and peers what the two had been working on. They suspect that pandemic-related content triggered the arrests, in part because in the weeks before and after their detention, police questioned acquaintances about what the two had done during the outbreak. ""They were told that Chen Mei has family members abroad, has provided foreign organisations with information about the pandemic and is basically handing a knife over to the enemy,"" said Chen Kun, who now lives in France. Police in Beijing did not respond to a faxed request for comment and court-appointed lawyers did not respond to phone calls. Citizen journalist Zhang Zhan also fell afoul of the law after reporting from Wuhan in the early days of the outbreak. She received a four-year sentence in December. The 2049bbs forum, which never had major reach, is now blocked in China. Yet the discussions continue and the records of the forum live on in a site called 2047, set up by a self-described ""person who walks the same path"" and some members of the old forum. Cai's father, who has not seen his son in more than a year, still cannot understand how his son ran afoul of the authorities. ""He didn't say anything bad. He didn't try to organise some protests,"" Cai Jianli said. ""How did this become picking quarrels and stirring up trouble?"""
Singapore,PM Lee Hsien Loong and other ministers speak out against racism after alleged attack,https://www.channelnewsasia.com/news/singapore/lee-hsien-loong-ministers-alleged-racism-man-racial-slur-kick-14782276,1620660059,"SINGAPORE: Prime Minister Lee Hsien Loong and other ministers spoke out on Monday (May 10) against racism in Singapore. It comes after a man allegedly used racial slurs and kicked a 55-year-old woman for not wearing a mask while she was brisk walking. Police investigations are ongoing. Mr Lee said he is confident that the police will establish the facts and bring the perpetrator to justice. ""It goes against everything that our multiracial society stands for, and the mutual respect and racial harmony that we hold so dear. It harms our international reputation more than we realise,"" he said. Minister for Sustainability and the Environment Grace Fu said in a Facebook post referencing the alleged attack that while COVID-19 has brought out the best in people in difficult situations, discriminatory behaviour and ""even violent xenophobic attacks"" stemming from fear and intolerance have also been witnessed around the world. ""Let us not allow such behaviour to take root here,"" she said. ""As we battle this unprecedented pandemic, it is more important than ever for our communities to band together and foster stronger cohesion."" Minister for Transport Ong Ye Kung shared Ms Fu's Facebook post. ""It is only by standing together that we can beat this virus. Discrimination and racism (are) worse than the virus,"" said Mr Ong. Minister in the Prime Minister's Office Tan See Leng, who also shared Ms Fu's post, said that the ""angst and apprehension"" during the COVID-19 crisis should not be allowed to divide and overcome people. ""We are better than this,"" he added."
Singapore,Former recruiter given jail for using NRIC details of 207 people to redeem masks,https://www.channelnewsasia.com/news/singapore/former-recruiter-contact-tracer-jail-nric-redeem-207-masks-14780690,1620639300,"SINGAPORE: A contact tracer used NRIC details he had retained from his previous job as a recruiter to illegally redeem 207 reusable face masks given out by the People's Association (PA) at the height of the COVID-19 pandemic. Emerson Goh Shou En, 32, was given seven months and six weeks' jail and a fine of S$3,000 by a court on Monday (May 10). He pleaded guilty to three charges of cheating the PA, retaining the personal information of 384 people, and leaving his house during the ""circuit breaker"" period to redeem the masks. Another two charges were considered in sentencing. The court heard that Goh was a contact tracer with NTUC FairPrice at the time of the offences. Before that, he was a recruiter with five companies between 2013 and 2020, publishing job openings and advertisements online to look for suitable candidates. Individuals would send him resumes with scanned copies of their National Registration Identity Cards (NRIC) as part of their job applications. Throughout his career in recruiting, Goh did not tell the applicants that he would retain and use the scanned copies of their NRICs for purposes beyond the job applications. In May 2020, the PA began a third round of a nationwide mask collection exercise as part of efforts to provide residents with enough face masks during the pandemic. From May 26 to Jun 14 last year, Singapore residents could collect one reusable mask each from designated vending machines across the country. The machines were automated and allowed people to collect face masks by scanning the barcode on their NRIC, birth certificate or any other Government-issued identification containing a barcode. No further verification was required after the barcode was scanned, and one face mask was issued per NRIC number. On May 26, 2020, Goh used his NRIC to collect his mask from a vending machine at Changi Simei Community Club. Goh realised that there was no further verification required beyond scanning the barcode on his NRIC. He then decided to scan the barcodes on the copies of NRICs belonging to job applicants he had in his phone to redeem more masks. Goh returned to the vending machines at the community club three times between 11.37pm on May 26, 2020 and 6.15pm on May 27, 2020, wearing a white cap to hide his face on two of the occasions. He used NRIC details belonging to 207 people and redeemed the corresponding number of face masks worth S$2,049.30 in total. The constituency director of Changi Simei CC lodged a police report on May 28, 2020, saying that an unidentified man was captured on closed-circuit television collecting reusable face masks from the vending machines. Between May 30, 2020 and Jun 3, 2020, six police reports were lodged by victims saying they could not collect their Government-issued face masks as they had already been redeemed by someone else. The prosecutor called for at least seven months and six weeks' jail and a fine of S$3,000, saying that the case involves exploitation of Government-run automated vending machines that were introduced for greater convenience to Singapore residents. ""Importantly, these face masks were meant for other Singapore citizens seeking to protect themselves and their loved ones from the COVID-19 pandemic,"" said Deputy Public Prosecutor Yeow Xuan. ""A deterrent sentence is therefore warranted to deter like-minded persons who may be emboldened to exploit future government distribution exercises that are digitised for the convenience of the community.""  THERE WERE ENOUGH MASKS AT THAT TIME: LAWYER Goh's lawyer Riko Isaac said this was an ""opportunistic crime"" and that his client was ""just making use of information that he had with him at that point in time"". He said Goh did not sell or leak the NRIC information for profit or to cause damage, and had withdrawn the face masks ""during a time where there was no shortage of face masks"". Goh did not take the masks to sell at inflated prices, but instead wanted to protect himself from COVID-19, said the lawyer. Mr Isaac also said PA did not suffer a loss as the masks were recovered from Goh's home. He highlighted Goh's obsessive-compulsive disorder, which results in frequent hand-washing, long baths and using inordinate amounts of soap to wash his hands, but accepted that no contributory or causal link was found between his condition and the offences. ""I will highlight that only six people lodged police reports,"" said Mr Isaac. ""When he went to withdraw the masks, many Singaporeans already purchased masks of their own and this was part of a later Government exercise. By this time there was no shortage of masks."" The judge said there was a need to deter like-minded offenders who might want to exploit such Government distribution exercises, and noted that an Institute of Mental Health report found that Goh was not of unsound mind."
Singapore,"Former UOB, OCBC bank employee jailed for cheating 7 people of nearly S$2 million",https://www.channelnewsasia.com/news/singapore/former-uob-ocbc-bank-employee-jailed-cheating-million-wealth-14780518,1620635466,"SINGAPORE: A former employee at two banks was given seven years' jail on Monday (May 10) for cheating seven people of almost S$2 million for fictitious wealth products. Han Delong, 34, was given the jail term after pleading guilty to 27 charges, including criminal breach of trust as an agent and cheating. Another 67 charges were considered in sentencing. The court heard that Han was a senior personal banker at United Overseas Bank (UOB) between August 2014 and December 2015, selling and marketing the bank's wealth products. He resigned from UOB in December 2015 and joined Oversea-Chinese Banking Corporation (OCBC) in March 2016. He was a premier relationship manager at OCBC until January 2017 and also sold the bank's wealth products. Because of his positions at both banks, Han enjoyed ""a close relationship"" with his former clients and victims, court documents said. Han began approaching former clients and promoting fixed deposits that were not actually offered by the respective banks. He cheated them into handing over sums ranging between S$20,000 and S$350,000 between February 2015 and May 2017. Several of the victims filed police reports, including one of Han's former UOB customers, who transferred S$350,000 to his personal account in February 2016 even though Han no longer worked at UOB at the time. Han issued the victim a forged letter printed with a UOB letterhead for the supposed UOB fixed deposit, and later issued another letter for a ""renewal"" of the fixed deposit. The Commercial Affairs Department uncovered a total of seven victims who had been cheated by Han of S$1,969,000 in total for fictitious fixed deposits or investment products purportedly offered by UOB or OCBC. Han dealt with the money in various ways, including transferring S$17,000 to his brother in February 2016 and transferring multiple batches of S$10,000 to a bank account he held jointly with his ex-girlfriend. He also spent S$11,899 in a cashier's order payable to Premium Automobiles, a car dealer, and transferred about S$20,000 to Singapore Pools. He used about S$350,000 he took from the victims to repay other victims. He has also since made restitution of S$275,000. The judge noted his early plea of guilt and accepted that Han was remorseful and has made partial restitution."
Singapore,Ministry of Law to maintain approach of naming accused people in sex crimes: Shanmugam,https://www.channelnewsasia.com/news/singapore/sex-crimes-accused-person-named-singapore-minlaw-shanmugam-14780042,1620628743,"SINGAPORE: The Ministry of Law will maintain its approach in naming those accused of sex crimes, said Minister of Law K Shanmugam on Monday (May 10). He was responding to a parliamentary question from Nominated Member of Parliament Tan Yia Swam about how media reports of ongoing trials of sex crimes are regulated and protecting medical professionals whose reputations are affected by coverage of such cases. ""The Ministry of Law has previously assessed whether the names of accused persons should not be published until they are convicted,"" said Mr Shanmugam in Parliament on Monday. Mr Shanmugam noted two approaches: Protecting the identity of accused persons until they are convicted with rules to grant anonymity to the accused in certain cases; and having open court proceedings where “all matters are out immediately”, which does not provide the courts with a general power to grant accused people anonymity to protect their reputations. “The downside in this second approach is that of course the reputation of accused persons is often irreparably damaged by the publicity arising from media coverage of an ongoing criminal trial, even if they are acquitted at the end of the day,"" he said. ""And I think Dr Tan's question probably arises from the trial of doctors and sex crimes, but this applies to all accused, a variety of cases."" Mr Shanmugam said: ""After assessments, we have decided to keep to our approach, which means that in general, accused persons are publicly tried and the verdict is publicly announced. That also allows unidentified victims of serial offenders, for example, to come forward and seek help. ""But I emphasise our position on this issue is, however, not set in concrete. We can also see the merits of shifting to some version of the first approach. So we will keep reviewing this while we are maintaining status quo."" Under the Ministry of Law's current approach, “there is anonymity given if it is required in public interest” in some circumstances, said the Law Minister. This includes protecting sensitive information related to national security, and the identities of young children or people and alleged victims of sexual or child abuse offences. “But the reason for doing that is to protect those vulnerable victims and children from being identified and give them a better life,"" said Mr Shanmugam. Noting that the courts have the power to prohibit the publication of the identity of the accused and impose some conditions on how the trial can be reported, Mr Shanmugam stressed that the media must also comply with these orders when covering the proceedings. “There are … pros and cons with both approaches, whether to allow or to prohibit the publication of names of accused persons until they are convicted. We will keep our position under review.”"
Singapore,Jail for man who pretended to rent condo unit that was later used by sex worker instead,https://www.channelnewsasia.com/news/singapore/jail-for-man-who-pretended-to-rent-condo-unit-that-was-later-14779768,1620623900,"SINGAPORE: In exchange for cash promised via an online advertisement, a man agreed to sign a tenancy agreement for a condominium unit he never intended to stay in. The unit was eventually used by a sex worker for vice, and she was nabbed during a police raid. Lin Fengchun, 26, was given four weeks' jail and a fine of S$400 on Monday (May 10) for one charge of cheating. Another two charges were taken into consideration. The court heard that Lin was in need of money in October 2019 when he came across an online ad seeking individuals to sign tenancy agreements on another person's behalf in exchange for quick cash. He responded to the ad, and a man identifying himself as ""Da Ge"" contacted Lin on WeChat. Da Ge said he was looking for a unit to rent, but could not as he held only a work permit. Lin agreed to help him rent various apartment units in exchange for payment. Da Ge later gave the address of a condo unit in the eastern part of Singapore to Lin, and arranged for Lin to meet the landlord's property agent on Oct 20, 2019. Lin met the property agent at the unit and pretended that he was working shifts as ground crew at Changi Airport. He said he had a girlfriend who was a flight stewardess and would stay over occasionally. After the agent spoke to the owner of the unit, the latter agreed to lease out the unit to Lin, believing he would be the tenant. Lin signed a tenancy agreement to rent the unit for 12 months from Nov 5, 2019, for a monthly rental of S$2,000. After he signed the agreement, Da Ge transferred 2,000 yuan (S$413) to him via WeChat as payment. On Da Ge's instructions, Lin left the tenancy agreement and keys to the unit inside the home before leaving with the main door unlocked. He did not stay at the unit at any point in time. On Apr 14, 2020, the police raided the unit and arrested a 35-year-old China national for providing sexual services inside the unit. Lin had cheated the owner of the unit into believing that he was renting it and that he would observe all covenants contained in the tenancy agreement, including that he would use it only as a private dwelling house and not for any immoral or illegal purpose. The prosecutor called for at least four weeks' jail and a fine of S$415, which was about the amount he received from Da Ge. Defence lawyer Tay Jing En, who took the case on under the Criminal Legal Aid Scheme, asked for a large fine of between S$5,000 and S$6,000 instead of a jail term. He said his client has no previous convictions and that there is ""no evidence that he knew what the unit he rented was to be used for"". ""I would also highlight that he has been issued with rather glowing testimonials particularly by his National Service commander,"" he said. He added that his client accepts that he ""acted foolishly, unthinkingly, stupidly even"" but said he did not do it maliciously. The judge granted him a deferment of his sentence to May 12. For cheating, Lin could have been jailed up to three years, fined, or both."
Singapore,"Police investigating case of a man who allegedly used racial slurs, kicked woman for not wearing mask",https://www.channelnewsasia.com/news/singapore/man-racial-slur-kick-woman-mask-brisk-walk-police-investigate-14779652,1620623030,"SINGAPORE: Police are investigating a case in which a man allegedly used racial slurs and kicked a 55-year-old woman for not wearing a mask while she was brisk walking. Mdm Hindocha Nita Vishnubhai was brisk walking on Friday (May 7) morning when a man approached her and asked her to pull her mask up from her chin, said her daughter, Ms Parveen Kaur. Mdm Nita was walking along Choa Chu Kang Drive when the man came up to her near a bus stop outside Northvale condominium. ""She explained that she was brisk walking but he didn't care. He hurled vulgarities and racial slurs at her,"" said Ms Kaur in a widely circulated Instagram Stories post. ""My mum responded with a 'God bless you' and the guy kicked her in the chest. My mum landed on her back and hurt herself."" The man ran away while her mother was left shaken and bleeding, said Ms Kaur. Ms Kaur said her mother brisk walks to work as a form of daily exercise, but the incident has left her ""afraid of taking a walk in her own country"". The incident came to light during a Mother's Day dinner on Sunday, when Ms Kaur learnt what happened and took photographs of her mother's injuries. The photographs show bloodied scrapes and bruises on Mdm Nita's elbow, arms and palms.  A report on the incident was lodged and investigations are ongoing, police said on Monday. All people in Singapore aged six and above are required to wear a mask when outside their homes, according to Ministry of Health guidelines. They may remove their mask while engaging in outdoor or strenuous exercise, including brisk walking or walking up hilly terrain, but must put it back on after exercising. Those walking at a normal pace are required to wear a mask."
